{
  "channel_routes": [
    {
      "channel_index": 0,
      "channel_name": "Drums",
      "target_mixer_track": 4,
      "target_name": "Kick 1",
      "type": "genplug"
    },
    {
      "channel_index": 1,
      "channel_name": "Sub 1",
      "target_mixer_track": 10,
      "target_name": "Sub 1",
      "type": "genplug"
    },
    {
      "channel_index": 2,
      "channel_name": "Bass 1",
      "target_mixer_track": 11,
      "target_name": "Bass 1",
      "type": "genplug"
    },
    {
      "channel_index": 3,
      "channel_name": "Bass 2",
      "target_mixer_track": 12,
      "target_name": "Bass 2",
      "type": "genplug"
    },
    {
      "channel_index": 4,
      "channel_name": "Synth 1",
      "target_mixer_track": 13,
      "target_name": "Synth 1",
      "type": "genplug"
    },
    {
      "channel_index": 5,
      "channel_name": "Synth 2",
      "target_mixer_track": 14,
      "target_name": "Synth 2",
      "type": "genplug"
    },
    {
      "channel_index": 6,
      "channel_name": "Pad",
      "target_mixer_track": 16,
      "target_name": "Pad",
      "type": "genplug"
    },
    {
      "channel_index": 7,
      "channel_name": "Vocals 1",
      "target_mixer_track": 17,
      "target_name": "Vocals 1",
      "type": "genplug"
    },
    {
      "channel_index": 8,
      "channel_name": "Riser 1",
      "target_mixer_track": 21,
      "target_name": "Riser Noise Metal",
      "type": "audioclip"
    }
  ],
  "known_control_routes": [
    {
      "level": 0.0,
      "meaning": "sidechain_control",
      "source": 124,
      "targets": [
        123,
        125
      ]
    }
  ],
  "mixer_tracks": [
    {
      "index": 0,
      "is_intentionally_silent": false,
      "is_reserved": false,
      "name": "Master",
      "pan": 0.0,
      "plugins": [],
      "receives_from": [
        1,
        126
      ],
      "role": "master",
      "routes_to": [],
      "stereo_separation": null,
      "tool_policy": {
        "suppress_layering_warning_without_audio": false,
        "suppress_low_end_width": false,
        "suppress_missing_hpf": false,
        "suppress_offcenter_bass": false,
        "suppress_ungrouped": false,
        "suppress_unused_track": false
      },
      "volume": {
        "db": 0.0,
        "normalized": 0.8
      }
    },
    {
      "index": 1,
      "is_intentionally_silent": false,
      "is_reserved": false,
      "name": "PreMaster MS",
      "pan": 0.0,
      "plugins": [],
      "receives_from": [
        2,
        3
      ],
      "role": "premaster",
      "routes_to": [
        {
          "level": 0.8,
          "meaning": null,
          "target": 0,
          "target_name": "Master"
        }
      ],
      "stereo_separation": 0.0,
      "tool_policy": {
        "suppress_layering_warning_without_audio": true,
        "suppress_low_end_width": true,
        "suppress_missing_hpf": true,
        "suppress_offcenter_bass": true,
        "suppress_ungrouped": true,
        "suppress_unused_track": false
      },
      "volume": {
        "db": 0.0,
        "normalized": 0.8
      }
    },
    {
      "index": 2,
      "is_intentionally_silent": false,
      "is_reserved": false,
      "name": "PreMaster M",
      "pan": 0.0,
      "plugins": [
        {
          "enabled": true,
          "mix": 1.0,
          "name": "Fruity parametric EQ 2",
          "parameter_count": 36,
          "parameter_signature": [
            {
              "display": "0.0dB",
              "index": 0,
              "name": "Band 1 level",
              "normalized": 0.5,
              "value": 0.5
            },
            {
              "display": "0.0dB",
              "index": 1,
              "name": "Band 2 level",
              "normalized": 0.5,
              "value": 0.5
            },
            {
              "display": "2.0dB",
              "index": 2,
              "name": "Band 3 level",
              "normalized": 0.5556,
              "value": 0.5556
            },
            {
              "display": "0.0dB",
              "index": 3,
              "name": "Band 4 level",
              "normalized": 0.5,
              "value": 0.5
            }
          ],
          "slot": 0
        },
        {
          "enabled": true,
          "mix": 1.0,
          "name": "Fruity Stereo Shaper",
          "parameter_count": 6,
          "parameter_signature": [
            {
              "display": "-6.0dB normal",
              "index": 0,
              "name": "Right into left channel volume",
              "normalized": 0.6577,
              "value": 0.6577
            },
            {
              "display": "-6.0dB normal",
              "index": 1,
              "name": "Left channel volume",
              "normalized": 0.6577,
              "value": 0.6577
            },
            {
              "display": "-6.0dB normal",
              "index": 2,
              "name": "Right channel volume",
              "normalized": 0.6577,
              "value": 0.6577
            },
            {
              "display": "-6.0dB normal",
              "index": 3,
              "name": "Left into right channel volume",
              "normalized": 0.6577,
              "value": 0.6577
            }
          ],
          "slot": 8
        },
        {
          "enabled": true,
          "mix": 1.0,
          "name": "Fruity PanOMatic",
          "parameter_count": 6,
          "parameter_signature": [
            {
              "display": "Centered",
              "index": 0,
              "name": "Panning",
              "normalized": 0.5,
              "value": 0.5
            },
            {
              "display": "0.0dB",
              "index": 1,
              "name": "Volume",
              "normalized": 0.8,
              "value": 0.8
            },
            {
              "display": "Sine",
              "index": 2,
              "name": "LFO shape",
              "normalized": 0.0,
              "value": 0.0
            },
            {
              "display": "OFF",
              "index": 3,
              "name": "LFO target",
              "normalized": 0.0,
              "value": 0.0
            }
          ],
          "slot": 9
        }
      ],
      "receives_from": [
        116,
        120,
        121,
        122,
        123,
        125
      ],
      "role": "premaster",
      "routes_to": [
        {
          "level": 0.8,
          "meaning": null,
          "target": 1,
          "target_name": "PreMaster MS"
        }
      ],
      "stereo_separation": 0.0,
      "tool_policy": {
        "suppress_layering_warning_without_audio": true,
        "suppress_low_end_width": true,
        "suppress_missing_hpf": true,
        "suppress_offcenter_bass": true,
        "suppress_ungrouped": true,
        "suppress_unused_track": false
      },
      "volume": {
        "db": 0.0,
        "normalized": 0.8
      }
    },
    {
      "index": 3,
      "is_intentionally_silent": false,
      "is_reserved": false,
      "name": "PreMaster S",
      "pan": 0.0,
      "plugins": [
        {
          "enabled": true,
          "mix": 1.0,
          "name": "Fruity parametric EQ 2",
          "parameter_count": 36,
          "parameter_signature": [
            {
              "display": "-17.5dB",
              "index": 0,
              "name": "Band 1 level",
              "normalized": 0.0131,
              "value": 0.0131
            },
            {
              "display": "-4.3dB",
              "index": 1,
              "name": "Band 2 level",
              "normalized": 0.3794,
              "value": 0.3794
            },
            {
              "display": "0.8dB",
              "index": 2,
              "name": "Band 3 level",
              "normalized": 0.5236,
              "value": 0.5236
            },
            {
              "display": "0.0dB",
              "index": 3,
              "name": "Band 4 level",
              "normalized": 0.5,
              "value": 0.5
            }
          ],
          "slot": 0
        },
        {
          "enabled": true,
          "mix": 1.0,
          "name": "Fruity Stereo Shaper",
          "parameter_count": 6,
          "parameter_signature": [
            {
              "display": "-6.0dB inverted",
              "index": 0,
              "name": "Right into left channel volume",
              "normalized": 0.3423,
              "value": 0.3423
            },
            {
              "display": "-6.0dB normal",
              "index": 1,
              "name": "Left channel volume",
              "normalized": 0.6577,
              "value": 0.6577
            },
            {
              "display": "-6.0dB normal",
              "index": 2,
              "name": "Right channel volume",
              "normalized": 0.6577,
              "value": 0.6577
            },
            {
              "display": "-6.0dB inverted",
              "index": 3,
              "name": "Left into right channel volume",
              "normalized": 0.3423,
              "value": 0.3423
            }
          ],
          "slot": 8
        },
        {
          "enabled": true,
          "mix": 1.0,
          "name": "Fruity PanOMatic",
          "parameter_count": 6,
          "parameter_signature": [
            {
              "display": "Centered",
              "index": 0,
              "name": "Panning",
              "normalized": 0.5,
              "value": 0.5
            },
            {
              "display": "0.0dB",
              "index": 1,
              "name": "Volume",
              "normalized": 0.8,
              "value": 0.8
            },
            {
              "display": "Sine",
              "index": 2,
              "name": "LFO shape",
              "normalized": 0.0,
              "value": 0.0
            },
            {
              "display": "OFF",
              "index": 3,
              "name": "LFO target",